{
  "data_id": "artifact_fcd5ed14590f47e592dffc2227f6c66e",
  "title": "Anomalies — June–July 2026",
  "description": "Complete anomaly calendar for the selected period.",
  "events": [
    {
      "key": "GSANOM-23018",
      "occurred_at": "2026-07-07T03:18:00.000Z",
      "title": "CGS-SGS: S1D: 3562: Data missing, FER above threshold",
      "description": "RFI with S/C CAPELLA-19 ACADIA @ 03:20:35 UTC, with impact on datatakes S1D-25912 and S1D-25913. Data recovery initiated.",
      "category": "rfi",
      "category_basis": "native_origin",
      "origin": "RFI",
      "status": "Closed",
      "criticality": "Blocking",
      "affected_systems": ["S-1"],
      "datatake_ids": ["S1D-25912", "S1D-25913"],
      "associated_datatake_count": 2
    },
    {
      "key": "GSANOM-22901",
      "occurred_at": "2026-06-15T14:22:00.000Z",
      "title": "S2A: Compression anomaly detected",
      "description": "Compression ratio exceeded threshold on L1B product generation. Processing resumed after parameter adjustment.",
      "category": "production",
      "category_basis": "native_origin",
      "origin": "Production",
      "status": "Completed",
      "criticality": "Critical",
      "affected_systems": ["S-2"],
      "datatake_ids": ["S2A-18745"],
      "associated_datatake_count": 1
    },
    {
      "key": "GSANOM-22850",
      "occurred_at": null,
      "title": "S3A OLCI: Calibration pending",
      "description": "OLCI calibration activity scheduled. Expected to complete within 48 hours. No data loss expected.",
      "category": "acquisition",
      "category_basis": "native_origin",
      "origin": "Acquisition",
      "status": "Open",
      "criticality": "Routine",
      "affected_systems": ["S-3"],
      "datatake_ids": [],
      "associated_datatake_count": 0
    },
    {
      "key": "GSANOM-22799",
      "occurred_at": "2026-07-01T09:45:00.000Z",
      "title": "S1A: Satellite manoeuvre",
      "description": "Scheduled orbit correction manoeuvre. Acquisition suspended for 2 hours. No datatakes lost.",
      "category": "satellite",
      "category_basis": "native_origin",
      "origin": "Satellite",
      "status": "Closed",
      "criticality": null,
      "affected_systems": ["S-1"],
      "datatake_ids": [],
      "associated_datatake_count": 0
    },
    {
      "key": "GSANOM-22745",
      "occurred_at": "2026-06-28T16:33:00.000Z",
      "title": "S5P: INU processor error — very long description to test collapsible rendering and wrapping behavior in the calendar widget interface",
      "description": "The INU (Instrument Neutral Unit) processor encountered an out-of-memory condition while processing a large datatake sequence. The condition was resolved by increasing the memory allocation for the processor. A full reprocessing of the affected datatakes was initiated on 2026-06-29 and is expected to complete by 2026-06-30. This is a detailed technical description that may be quite lengthy and should be displayed with a collapsible/expandable UI to avoid cluttering the calendar view.",
      "category": "production",
      "category_basis": "native_origin",
      "origin": "IPF",
      "status": "Delegated",
      "criticality": "Critical",
      "affected_systems": ["S-5p"],
      "datatake_ids": ["S5P-45612", "S5P-45613", "S5P-45614"],
      "associated_datatake_count": 3
    },
    {
      "key": "GSANOM-22701",
      "occurred_at": "2026-06-20T11:15:00.000Z",
      "title": "S2C: Acquisition station downlink issue",
      "description": "Ground station in Kiruna reported packet loss during S2C pass. One datatake incomplete, reacquired on next pass.",
      "category": "acquisition",
      "category_basis": "native_origin",
      "origin": "Acquisition",
      "status": "Rejected",
      "criticality": "Routine",
      "affected_systems": ["S-2"],
      "datatake_ids": ["S2C-19203"],
      "associated_datatake_count": 1
    },
    {
      "key": "GSANOM-22698",
      "occurred_at": "2026-07-05T07:00:00.000Z",
      "title": "S1C: Thermal monitoring alert",
      "description": "",
      "category": "satellite",
      "category_basis": "native_origin",
      "origin": "Satellite",
      "status": "Open",
      "criticality": null,
      "affected_systems": ["S-1"],
      "datatake_ids": [],
      "associated_datatake_count": 0
    }
  ]
}
